,,,,,,,
,Rindu,"  search
  team",,,,,
,,,,,,,
,Name Autobot,Klasifikasi,Status,Tugas,Tujuan,Fungsi,Links autobuilder
,Bot Integrasi Data,Otobot Integrasi Lintas Superbot,⏳Build,Menyatukan data dari berbagai sumber,Menyediakan data terintegrasi,Mengintegrasikan data lintas departemen,
,Otobot Insight Generator,Otobot Integrasi Lintas Superbot,🚀Ready,Menganalisis data untuk insight,Memberikan wawasan strategis,Menghasilkan insight dari data terintegrasi,https://chatgpt.com/g/g-68da24d5e39c8191a82a77fb23103b02-insigo-otobot-insight-generator
,Otobot Proposal AI,Otobot Integrasi Lintas Superbot,⏳Build,Menyusun draf proposal inovasi,Menghasilkan proposal produk baru,Menyusun proposal otomatis berdasarkan data,
,Otobot Ideasi & Tren,Ideasi & Tren,🚀Ready,Menghasilkan ide dan tren baru,Meningkatkan inovasi produk,Mengidentifikasi ide dan tren baru,https://chatgpt.com/g/g-68da2b9f19d88191a2caf9795ef5a446-trenide-otobot-ideasi-tren
,Bot Analisis Tren Pasar,Ideasi & Tren,🚀Ready,Mengidentifikasi tren pasar terkini,Menentukan arah produk baru,Menganalisis tren pasar,https://chatgpt.com/g/g-68da2cbc92f48191b6687b775507cf37-matre-analisis-tren-market
,Bot Analisis Tren Teknologi,Ideasi & Tren,⏳Build,Mengidentifikasi teknologi baru,Menemukan peluang teknologi baru,Menganalisis tren teknologi,
,Bot Analisis Konsumen,Ideasi & Tren,⏳Build,Mengetahui preferensi konsumen,Memahami kebutuhan konsumen,Menganalisis perilaku konsumen,
,Bot Pemantau Media Sosial,Ideasi & Tren,⏳Build,Menganalisis media sosial,Menangkap tren dari media sosial,Memantau tren media sosial,
,Bot Analisis Kompetitor,Ideasi & Tren,⏳Build,Mengidentifikasi strategi kompetitor,Mengetahui posisi kompetitor,Menganalisis kompetitor,
,Bot Analisis Produk Kompetitor,Ideasi & Tren,⏳Build,Menganalisis produk pesaing,Menemukan keunggulan kompetitor,Menganalisis produk kompetitor,
,Bot Analisis Strategi Kompetitor,Ideasi & Tren,⏳Build,Mengidentifikasi strategi kompetitor,Mengatur strategi menghadapi kompetitor,Menganalisis strategi kompetitor,
,Bot Ideasi Konsep,Ideasi & Tren,⏳Build,Membuat konsep produk baru,Menemukan ide produk yang inovatif,Mengembangkan konsep ide produk,
,Bot Brainstorming,Ideasi & Tren,⏳Build,Mengumpulkan ide-ide kreatif,Memulai proses ideasi,Menghasilkan ide melalui brainstorming,
,Bot Evaluasi Ide,Ideasi & Tren,⏳Build,Menilai kelayakan ide,Menentukan ide yang layak dipilih,Mengevaluasi ide produk,
,Trend Monitoring Bot,Ideasi & Tren,⏳Build,Memantau perkembangan tren,Menyusun daftar tren terbaru,Memantau tren pasar dan teknologi,
,Idea Generation Bot,Ideasi & Tren,⏳Build,Menyusun daftar ide baru,Menemukan konsep produk baru,Menghasilkan ide produk baru,
,Consumer Insight Bot,Ideasi & Tren,⏳Build,Mengumpulkan insight konsumen,Membantu dalam pengembangan produk,Menghasilkan wawasan dari konsumen,
,Idea Evaluation Bot,Ideasi & Tren,⏳Build,Memilih ide yang layak dikembangkan,Mengoptimalkan pemilihan ide produk,Mengevaluasi kualitas ide,
,Bot Perencanaan Strategi Produk,Ideasi & Tren,⏳Build,Menyusun strategi produk baru,Membangun rencana pengembangan produk,Merencanakan strategi produk,
,Bot Penilaian Risiko Tren,Ideasi & Tren,⏳Build,Menilai risiko tren pasar,Meminimalkan dampak risiko tren,Menganalisis risiko tren,
,Bot Penilaian Impact Tren,Ideasi & Tren,⏳Build,Menilai dampak tren terhadap produk,Memahami dampak tren pada produk,Menganalisis dampak tren,
,Otobot Riset Formula,Riset Formula & Bahan Aktif,⏳Build,Mencari bahan dan formula tepat,Menghasilkan formula produk baru,Meneliti bahan dan formula produk,
,Bot Riset Bahan,Riset Formula & Bahan Aktif,⏳Build,Menentukan bahan aktif yang tepat,Memilih bahan untuk formulasi,Menganalisis bahan aktif,
,Bot Riset Bahan Aktif,Riset Formula & Bahan Aktif,⏳Build,Menyusun bahan aktif untuk formula,Menentukan bahan aktif yang optimal,Menganalisis bahan aktif,
,Bot Riset Bahan Pendukung,Riset Formula & Bahan Aktif,⏳Build,Menyusun bahan pendukung formulasi,Menyediakan bahan pendukung yang sesuai,Mencari bahan pendukung,
,Bot Analisis Interaksi Bahan,Riset Formula & Bahan Aktif,⏳Build,Menilai interaksi antar bahan,Memastikan kompatibilitas bahan,Menganalisis interaksi bahan,
,Bot Riset Literatur & Paten,Riset Formula & Bahan Aktif,⏳Build,Mengidentifikasi penelitian terkait,Menemukan riset terkait bahan,Mencari literatur dan paten terkait,
,Bot Riset Jurnal Ilmiah,Riset Formula & Bahan Aktif,⏳Build,Mencari riset terbaru tentang bahan,Mengikuti perkembangan riset ilmiah,Meneliti jurnal ilmiah terkait,
,Bot Riset Paten,Riset Formula & Bahan Aktif,⏳Build,Mencari paten bahan atau formula,Menghindari pelanggaran paten,Menganalisis paten terkait produk,
,Bot Analisis Formula Kompetitor,Riset Formula & Bahan Aktif,⏳Build,Mengidentifikasi formula pesaing,Menemukan keunggulan formula,Menganalisis formula kompetitor,
,Bot Simulasi Formula,Riset Formula & Bahan Aktif,⏳Build,Menyimulasikan interaksi bahan,Mengoptimalkan formula produk,Mensimulasikan formula,
,Bot Kelayakan Formula,Riset Formula & Bahan Aktif,⏳Build,Memastikan formula sesuai standar,Memvalidasi kelayakan formula,Menguji kelayakan formula,
,Ingredient Research Bot,Riset Formula & Bahan Aktif,⏳Build,Mengidentifikasi bahan untuk produk,Memilih bahan baku yang relevan,Mencari bahan baku untuk formulasi,
,Formula Ideation Bot,Riset Formula & Bahan Aktif,⏳Build,Mengembangkan ide formulasi,Memulai proses formulasi,Menghasilkan ide formula,
,Literature Review Bot,Riset Formula & Bahan Aktif,⏳Build,Mencari referensi terkait formula,Mendapatkan data terkait bahan,Menyusun review literatur,
,Bot Riset Teknologi Enkapsulasi,Riset Formula & Bahan Aktif,⏳Build,Mencari teknologi enkapsulasi baru,Menggunakan teknologi enkapsulasi,Menganalisis teknologi enkapsulasi,
,Bot Riset Pengawet & Antibakteri,Riset Formula & Bahan Aktif,⏳Build,Mencari bahan pengawet yang efektif,Menjaga kualitas produk,Meneliti bahan pengawet & antibakteri,
,Bot Riset Teknologi Baru (Bahan),Riset Formula & Bahan Aktif,⏳Build,Mencari bahan dan teknologi baru,Meningkatkan kualitas dan inovasi,Meneliti teknologi bahan terbaru,
,Bot Evaluasi Sumber Bahan,Riset Formula & Bahan Aktif,⏳Build,Menilai sumber bahan yang sesuai,Menyusun bahan baku yang berkualitas,Mengevaluasi sumber bahan,
,Bot Analisis Keberlanjutan Bahan,Riset Formula & Bahan Aktif,⏳Build,Mengevaluasi dampak bahan,Memastikan keberlanjutan bahan,Menganalisis keberlanjutan bahan,
,Otobot Formulasi & Sampel,Formulasi & Sampel,⏳Build,Menyusun dan menguji sampel,Menyediakan sampel yang valid,Mengelola formulasi dan sampel,
,Bot Desain Formulasi,Formulasi & Sampel,⏳Build,Merancang formula produk,Membuat desain formula produk,Mendesain formula awal,
,Bot Formulasi Awal,Formulasi & Sampel,⏳Build,Mengembangkan formula awal,Menciptakan formula pertama,Membuat formula awal,
,Bot Optimasi Formulasi,Formulasi & Sampel,⏳Build,Menyesuaikan formula untuk efisiensi,Meningkatkan efektivitas formula,Mengoptimalkan formula,
,Bot Pembuatan Sampel Lab,Formulasi & Sampel,⏳Build,Membuat sampel formula produk,Menyediakan sampel untuk pengujian,Membuat sampel di lab,
,Bot Batch Kecil,Formulasi & Sampel,⏳Build,Menghasilkan sampel kecil,Menyediakan sampel untuk uji coba,Membuat batch kecil sampel,
,Bot Uji Coba Formula,Formulasi & Sampel,⏳Build,Melakukan pengujian awal formula,Memvalidasi efektivitas formula,Menguji coba formula,
,Bot Iterasi Prototipe,Formulasi & Sampel,⏳Build,Membuat perubahan pada prototipe,Menyempurnakan produk prototipe,Iterasi prototipe produk,
,Bot Penyesuaian Komposisi,Formulasi & Sampel,⏳Build,Menyesuaikan bahan dalam formula,Memastikan formula sesuai standar,Menyesuaikan komposisi formula,
,Bot Validasi Formulasi,Formulasi & Sampel,⏳Build,Menyelesaikan uji validasi formula,Menjamin kesesuaian formula produk,Memvalidasi formulasi,
,Formulation Bot,Formulasi & Sampel,⏳Build,Membantu dalam pembuatan formula,Menghasilkan formula yang tepat,Membantu dalam formulasi,
,Sample Preparation Bot,Formulasi & Sampel,⏳Build,Menyiapkan sampel untuk pengujian,Menyediakan sampel untuk evaluasi,Menyiapkan sampel untuk uji coba,
,Formula Iteration Bot,Formulasi & Sampel,⏳Build,Memodifikasi formula secara berkala,Memperbaiki dan menguji ulang formula,Mengiterasi formula,
,Bot Pengujian Prototipe,Formulasi & Sampel,⏳Build,Menguji prototipe formula,Menyempurnakan prototipe produk,Menguji prototipe produk,
,Bot Pemrograman Reaksi Formula,Formulasi & Sampel,⏳Build,Memrogramkan respons bahan,Meningkatkan efektivitas formula,Menentukan reaksi formula,
,Bot Pengujian Formula Awal,Formulasi & Sampel,⏳Build,Menjalankan uji coba formula,Menyediakan validasi formula awal,Menguji formula awal,
,Otobot Pengujian & Stabilitas,Pengujian & Stabilitas,⏳Build,Memantau dan melakukan pengujian stabilitas,Memastikan kualitas produk stabil,Mengelola pengujian stabilitas,
,Bot Uji Stabilitas,Pengujian & Stabilitas,⏳Build,Melakukan pengujian stabilitas,Menjamin kestabilan produk,Melakukan uji stabilitas formula,
,Bot Uji Stabilitas Dipercepat,Pengujian & Stabilitas,⏳Build,Menguji stabilitas dalam waktu singkat,Mempercepat validasi stabilitas produk,Melakukan uji stabilitas cepat,
,Bot Uji Stabilitas Real-Time,Pengujian & Stabilitas,⏳Build,Mengukur kestabilan dalam waktu nyata,Memastikan produk tahan lama,Menguji stabilitas real-time,
,Bot Uji Beku-Cair,Pengujian & Stabilitas,⏳Build,Mengukur kestabilan suhu produk,Menjamin kualitas dalam suhu ekstrim,Menguji siklus beku-cair,
,Bot Uji Fotostabilitas,Pengujian & Stabilitas,⏳Build,Menilai ketahanan terhadap sinar UV,Memastikan produk tahan cahaya,Menguji ketahanan terhadap cahaya,
,Bot Simulasi Transportasi,Pengujian & Stabilitas,⏳Build,Menguji ketahanan selama transportasi,Memastikan produk tetap stabil dalam perjalanan,Mensimulasikan transportasi produk,
,Bot Uji Fisikokimia,Pengujian & Stabilitas,⏳Build,Menilai kestabilan fisik & kimia,Mengidentifikasi sifat bahan produk,Menguji sifat fisik dan kimia produk,
,Bot Uji pH,Pengujian & Stabilitas,⏳Build,Memeriksa tingkat pH produk,Memastikan pH sesuai standar,Mengukur pH produk,
,Bot Uji Viskositas,Pengujian & Stabilitas,⏳Build,Menguji kelikatan produk,Memastikan kekentalan produk,Mengukur viskositas produk,
,Bot Uji Densitas,Pengujian & Stabilitas,⏳Build,Menguji massa per volume produk,Memastikan densitas produk tepat,Mengukur densitas produk,
,Bot Uji Ukuran Partikel,Pengujian & Stabilitas,⏳Build,Menilai ukuran partikel bahan,Menjamin distribusi partikel yang tepat,Mengukur ukuran partikel produk,
,Bot Uji Penampilan,Pengujian & Stabilitas,⏳Build,Memeriksa tampilan produk,Memastikan produk memiliki penampilan baik,Menguji penampilan produk,
,Bot Uji Mikrobiologi,Pengujian & Stabilitas,⏳Build,Menguji ketahanan terhadap mikroba,Memastikan produk bebas mikroba,Menguji mikrobiologi produk,
,Bot Uji Challenge (Pengawet),Pengujian & Stabilitas,⏳Build,Menguji daya tahan pengawet,Memastikan pengawet berfungsi dengan baik,Menguji pengawet dalam produk,
,Bot Uji Beban Mikrob,Pengujian & Stabilitas,⏳Build,Menilai ketahanan terhadap mikroba,Memastikan ketahanan produk terhadap mikroba,Menguji beban mikrobial,
,Bot Uji Sterilitas,Pengujian & Stabilitas,⏳Build,Melakukan uji sterilisasi produk,Memastikan produk bebas dari mikroba berbahaya,Menguji sterilisasi produk,
,Bot Uji Keamanan,Pengujian & Stabilitas,⏳Build,Menilai risiko keamanan produk,Memastikan produk aman digunakan,Menguji keamanan produk,
,Bot Uji Iritasi Kulit,Pengujian & Stabilitas,⏳Build,Mengukur efek iritasi pada kulit,Memastikan produk tidak iritatif,Menguji iritasi pada kulit,
,Bot Uji Sensitisasi,Pengujian & Stabilitas,⏳Build,Menilai sensitivitas produk,Memastikan produk tidak menimbulkan reaksi alergi,Menguji sensitisasi produk,
,Bot Uji Toksisitas,Pengujian & Stabilitas,⏳Build,Menilai efek toksik pada produk,Memastikan produk tidak beracun,Menguji toksisitas produk,
,Bot Uji Kompatibilitas,Pengujian & Stabilitas,⏳Build,Menilai kecocokan bahan produk,Memastikan bahan cocok satu sama lain,Menguji kompatibilitas bahan,
,Bot Uji Kompatibilitas Kemasan,Pengujian & Stabilitas,⏳Build,Menilai interaksi produk dengan kemasan,Memastikan kemasan tidak merusak produk,Menguji kompatibilitas kemasan,
,Bot Uji Kompatibilitas Proses,Pengujian & Stabilitas,⏳Build,Menilai kecocokan proses produksi,Memastikan proses produksi sesuai,Menguji proses kompatibilitas,
,Bot Validasi Metode Pengujian,Pengujian & Stabilitas,⏳Build,Menilai metode pengujian yang digunakan,Menjamin hasil pengujian valid,Memvalidasi metode pengujian,
,Stability Testing Bot,Pengujian & Stabilitas,⏳Build,Menguji kestabilan produk,Memastikan produk tetap stabil,Melakukan uji stabilitas produk,
,Physical & Chemical Testing Bot,Pengujian & Stabilitas,⏳Build,Mengukur sifat fisik dan kimia,Memastikan kualitas produk konsisten,Melakukan uji fisik & kimia,
,Microbiological Testing Bot,Pengujian & Stabilitas,⏳Build,Menilai keberadaan mikroorganisme,Memastikan produk bebas dari mikroba berbahaya,Menguji uji mikrobiologi,
,Bot Pengujian Keberlanjutan,Pengujian & Stabilitas,⏳Build,Menilai dampak lingkungan produk,Memastikan produk ramah lingkungan,Menguji keberlanjutan produk,
,Bot Pengujian Kinerja dalam Penggunaan Sehari-hari,Pengujian & Stabilitas,⏳Build,Menilai efisiensi produk sehari-hari,Memastikan produk berfungsi optimal dalam pemakaian sehari-hari,Menguji kinerja produk harian,
,Otobot Evaluasi Performa,Evaluasi Performa,⏳Build,Menilai kinerja produk/layanan,Menyusun laporan performa produk,Mengelola evaluasi performa,
,Bot Uji Efikasi Pengguna,Evaluasi Performa,⏳Build,Melakukan uji coba pada pengguna,Menilai keefektifan produk bagi pengguna,Menguji efikasi produk pada pengguna,
,Bot Uji Aplikasi,Evaluasi Performa,⏳Build,Melakukan uji aplikasi pada produk,Memastikan produk diterima dengan baik,Menguji aplikasi produk,
,Bot Uji Panel Konsumen,Evaluasi Performa,⏳Build,Mengumpulkan feedback panel konsumen,Menilai respons konsumen terhadap produk,Menguji reaksi panel konsumen,
,Bot Uji Fokus Grup,Evaluasi Performa,⏳Build,Melakukan sesi fokus grup,Mengumpulkan masukan mendalam tentang produk,Menguji melalui diskusi kelompok,
,Bot Survei Pengguna,Evaluasi Performa,⏳Build,Mengumpulkan data dari pengguna,Menilai pengalaman pengguna produk,Melakukan survei pengguna,
,Bot Analisis Ulasan Pelanggan,Evaluasi Performa,⏳Build,Memantau dan menganalisis feedback pelanggan,Memperbaiki produk berdasarkan ulasan,Menganalisis ulasan pelanggan,
,Bot Evaluasi Sensorik,Evaluasi Performa,⏳Build,Menganalisis aspek sensorik produk,Memastikan produk menyentuh semua indera dengan baik,Menguji sensasi produk,
,Bot Uji Banding Produk,Evaluasi Performa,⏳Build,Melakukan perbandingan produk,Menilai keunggulan dan kelemahan produk,Membandingkan produk dengan kompetitor,
,Bot Analisis Data Performa,Evaluasi Performa,⏳Build,Mengumpulkan dan menganalisis data,Mengoptimalkan kinerja produk berdasarkan data,Menganalisis data performa produk,
,Bot Validasi Klaim Produk,Evaluasi Performa,⏳Build,Memastikan klaim produk dapat dibuktikan,Menjamin keakuratan klaim produk,Memvalidasi klaim produk,
,Otobot Inovasi Proses,Inovasi Proses,⏳Build,Menilai dan merancang proses baru,Meningkatkan efisiensi dan inovasi,Mengelola inovasi proses produksi,
,Bot Desain Proses Baru,Inovasi Proses,⏳Build,Merancang proses produksi baru,Menyusun proses yang lebih efisien,Merancang desain proses baru,
,Bot Optimasi Proses Produksi,Inovasi Proses,⏳Build,Memperbaiki proses yang ada,Mengurangi pemborosan dalam produksi,Mengoptimalkan proses produksi,
,Bot Optimasi Parameter,Inovasi Proses,⏳Build,Mengatur dan menyesuaikan parameter,Meningkatkan efisiensi dan kualitas,Menyesuaikan parameter produksi,
,Bot Analisis Bottleneck,Inovasi Proses,⏳Build,Mengidentifikasi masalah dalam proses,Mempercepat aliran produksi,Menganalisis bottleneck dalam proses,
,Bot Otomasi & Robotika,Inovasi Proses,⏳Build,Mengimplementasikan solusi otomatis,Meningkatkan kecepatan dan akurasi,Menerapkan otomatisasi dan robotik,
,Bot Integrasi Teknologi Baru,Inovasi Proses,⏳Build,Menerapkan teknologi terkini,Menjamin kemajuan teknologi dalam produksi,Mengintegrasikan teknologi baru,
,Bot Simulasi Proses Produksi,Inovasi Proses,⏳Build,Mensimulasikan proses produksi,Mengoptimalkan alur produksi,Melakukan simulasi proses produksi,
,Bot Peningkatan Keberlanjutan Proses,Inovasi Proses,⏳Build,Memastikan keberlanjutan produksi,Menjamin ramah lingkungan dan efisien,Meningkatkan keberlanjutan proses,
,Bot Pengendalian Kualitas Proses,Inovasi Proses,⏳Build,Memastikan kualitas produksi tetap terjaga,Menjamin hasil produksi yang berkualitas,Mengontrol kualitas proses produksi,
,Bot Efisiensi Energi Produksi,Inovasi Proses,⏳Build,Menurunkan penggunaan energi,Mengurangi biaya operasional,Mengoptimalkan konsumsi energi,
,Bot Pengujian Keberlanjutan Proses,Inovasi Proses,⏳Build,Melakukan uji keberlanjutan pada proses,Mengurangi dampak lingkungan dalam produksi,Menguji keberlanjutan proses,
,Bot Pengujian Kinerja Mesin,Inovasi Proses,⏳Build,Menilai kinerja mesin dalam produksi,Memastikan mesin berfungsi optimal,Menguji performa mesin produksi,
,Otobot Pengembangan Kemasan,Pengembangan Kemasan,⏳Build,Merancang dan mengembangkan kemasan,Meningkatkan daya tarik dan keamanan produk,Mengelola pengembangan kemasan,
,Bot Desain Kemasan,Pengembangan Kemasan,⏳Build,Membuat desain kemasan produk,Membuat kemasan yang menarik dan fungsional,Mendesain kemasan produk,
,Bot Desain Struktural,Pengembangan Kemasan,⏳Build,Merancang kemasan dengan struktur yang kuat,Menjamin kemasan aman dan kokoh,Mendesain struktur kemasan,
,Bot Desain Grafis,Pengembangan Kemasan,⏳Build,Membuat desain grafis untuk kemasan,Membuat kemasan visual menarik,Mendesain grafis kemasan,
,Bot Pemilihan Material,Pengembangan Kemasan,⏳Build,Memilih bahan kemasan yang tepat,Menjamin material kemasan aman dan efisien,Memilih material kemasan,
,Bot Prototipe Kemasan,Pengembangan Kemasan,⏳Build,Mengembangkan prototipe kemasan,Menguji desain kemasan sebelum produksi massal,Membuat prototipe kemasan,
,Bot Pencetakan 3D Kemasan,Pengembangan Kemasan,⏳Build,Mencetak desain kemasan secara tiga dimensi,Mengoptimalkan desain kemasan dengan teknologi 3D,Melakukan pencetakan 3D kemasan,
,Bot Mockup Digital,Pengembangan Kemasan,⏳Build,Mendesain mockup digital kemasan,Menyediakan representasi digital dari kemasan,Membuat mockup digital kemasan,
,Bot Pengujian Kemasan,Pengembangan Kemasan,⏳Build,Melakukan uji ketahanan kemasan,Memastikan kemasan tahan lama dan aman,Menguji kekuatan dan fungsionalitas kemasan,
,Bot Uji Jatuh,Pengembangan Kemasan,⏳Build,Menguji kemasan dengan uji jatuh,Menilai ketahanan kemasan terhadap benturan,Menguji ketahanan jatuh kemasan,
,Bot Uji Getaran,Pengembangan Kemasan,⏳Build,Menguji ketahanan kemasan terhadap getaran,Menjamin kemasan tidak rusak saat pengiriman,Menguji ketahanan getaran kemasan,
,Bot Uji Kebocoran,Pengembangan Kemasan,⏳Build,Memastikan kemasan tidak bocor,Memastikan kemasan tidak bocor saat pengiriman,Menguji ketahanan kebocoran kemasan,
,Bot Uji Ketahanan Suhu,Pengembangan Kemasan,⏳Build,Menguji kemasan dalam kondisi suhu ekstrem,Menjamin kemasan tahan suhu ekstrem,Menguji ketahanan suhu kemasan,
,Bot Uji Kompatibilitas Produk,Pengembangan Kemasan,⏳Build,Memastikan produk tidak bereaksi negatif dengan kemasan,Menjamin produk tetap aman dalam kemasan,Menguji kompatibilitas produk dan kemasan,
,Bot Evaluasi Pengguna Kemasan,Pengembangan Kemasan,⏳Build,Menganalisis feedback pengguna tentang kemasan,Memastikan kemasan sesuai dengan preferensi pengguna,Mengumpulkan evaluasi pengguna,
,Bot Kepatuhan Kemasan,Pengembangan Kemasan,⏳Build,Memastikan kemasan sesuai regulasi,Menjamin kemasan aman dan sesuai standar,Memastikan kepatuhan kemasan,
,Bot Kepatuhan Label,Pengembangan Kemasan,⏳Build,Memastikan label sesuai dengan standar yang berlaku,Menjamin produk tidak melanggar regulasi label,Memastikan label sesuai regulasi,
,Bot Kepatuhan Material,Pengembangan Kemasan,⏳Build,Memastikan bahan kemasan aman,Menjamin kualitas bahan baku kemasan,Memastikan material kemasan sesuai standar,
,Bot Optimasi Biaya Kemasan,Pengembangan Kemasan,⏳Build,Menyusun kemasan dengan biaya efektif,Menurunkan biaya produksi kemasan,Mengoptimalkan biaya kemasan,
,Bot Daur Ulang & Keberlanjutan Kemasan,Pengembangan Kemasan,⏳Build,Menggunakan bahan daur ulang pada kemasan,Mengurangi dampak lingkungan kemasan,Mengembangkan kemasan ramah lingkungan,
,Packaging Design Bot,Pengembangan Kemasan,⏳Build,Menyusun desain kemasan yang menarik,Membuat kemasan estetis dan fungsional,Mendesain kemasan produk,
,Packaging Testing Bot,Pengembangan Kemasan,⏳Build,Menguji ketahanan kemasan produk,Menjamin kemasan aman dan kuat,Melakukan uji kekuatan kemasan,
,Material Compatibility Bot,Pengembangan Kemasan,⏳Build,Menguji kecocokan material dengan produk,Menjamin kemasan kompatibel dengan produk,Menguji kompatibilitas material kemasan,
,Otobot Dokumentasi & Regulasi,Dokumentasi & Regulasi,⏳Build,Memastikan kepatuhan terhadap regulasi,Menjamin kelancaran regulasi produk,Menyusun dan mengelola dokumentasi regulasi,
,Bot Kepatuhan Regulasi,Dokumentasi & Regulasi,⏳Build,Memastikan produk memenuhi standar lokal,Menghindari masalah regulasi lokal,Memastikan kepatuhan regulasi lokal,
,Bot Regulasi Lokal,Dokumentasi & Regulasi,⏳Build,Mematuhi peraturan lokal negara,Menjamin kepatuhan terhadap hukum lokal,Memastikan produk sesuai regulasi lokal,
,Bot Regulasi Internasional,Dokumentasi & Regulasi,⏳Build,Mematuhi regulasi internasional,Menghindari masalah hukum internasional,Memastikan produk sesuai regulasi internasional,
,Bot Pemenuhan Standar,Dokumentasi & Regulasi,⏳Build,Memastikan produk memenuhi standar internasional,Menjamin kualitas dan keselamatan produk,Memenuhi standar kualitas dan keamanan,
,Bot Dokumentasi Produk,Dokumentasi & Regulasi,⏳Build,Mengelola data produk terkait dokumen,Menyusun dokumen produk secara tepat,Membuat dokumentasi produk,
,Bot Penyusunan Dossier,Dokumentasi & Regulasi,⏳Build,Menyusun dokumen legal produk,Memenuhi syarat legalitas produk,Menyusun dossier produk,
,Bot Penyusunan SDS,Dokumentasi & Regulasi,⏳Build,Mengelola data keselamatan bahan,Menjamin keselamatan bahan produk,Menyusun Safety Data Sheets (SDS),
,Bot Penyusunan COA,Dokumentasi & Regulasi,⏳Build,Mengelola data analisis produk,Menyusun laporan pengujian produk,Menyusun Certificate of Analysis (COA),
,Bot Penyusunan Laporan Uji,Dokumentasi & Regulasi,⏳Build,Menyusun laporan hasil uji produk,Memberikan bukti validitas produk,Menyusun laporan uji,
,Bot Dokumentasi Label & Klaim,Dokumentasi & Regulasi,⏳Build,Membuat label yang sesuai dengan standar hukum,Menjamin label sesuai dengan peraturan,Menyusun label produk sesuai regulasi,
,Bot Sertifikasi Produk,Dokumentasi & Regulasi,⏳Build,Mendapatkan sertifikasi untuk produk,Memastikan produk memenuhi sertifikasi yang diperlukan,Memastikan produk mendapatkan sertifikasi,
,Bot Sertifikasi Keamanan/Mutu,Dokumentasi & Regulasi,⏳Build,Menjamin produk bebas dari potensi bahaya,Menjamin keamanan produk bagi konsumen,Mendapatkan sertifikasi keamanan produk,
,Bot Sertifikasi Halal/Organik,Dokumentasi & Regulasi,⏳Build,Memastikan produk memenuhi kriteria halal,Menjamin produk sesuai dengan nilai halal,Mendapatkan sertifikasi halal/organik,
,Bot Sertifikasi Lainnya,Dokumentasi & Regulasi,⏳Build,Memenuhi berbagai sertifikasi tambahan,Memenuhi persyaratan legal dan kualitas lainnya,Mengurus sertifikasi produk lainnya,
,Bot Paten & HKI,Dokumentasi & Regulasi,⏳Build,Mengurus paten dan hak cipta,Menjamin perlindungan hak kekayaan intelektual,Mengelola hak kekayaan intelektual (HKI),
,Bot Pencarian Paten,Dokumentasi & Regulasi,⏳Build,Menelusuri paten terkait produk,Menjamin orisinalitas dan perlindungan produk,Menyusun pencarian paten terkait produk,
,Bot Penyusunan Dokumen Paten,Dokumentasi & Regulasi,⏳Build,Menyusun dokumen paten yang diperlukan,Menjamin pengakuan paten produk,Menyusun dokumen paten produk,
,Bot Pengelolaan Merek/Hak Cipta,Dokumentasi & Regulasi,⏳Build,Mengurus pengurusan merek dan hak cipta,Memastikan merek dan produk terlindungi hukum,Mengelola merek dan hak cipta,
,Bot Audit & Legal,Dokumentasi & Regulasi,⏳Build,Melakukan audit legalitas produk,Memastikan legalitas produk di pasar,Mengelola audit dan regulasi legal,
,Bot Persiapan Audit,Dokumentasi & Regulasi,⏳Build,Menyusun laporan audit untuk produk,Memastikan kesiapan untuk audit legal,Menyusun persiapan audit,
,Bot Kepatuhan Internal,Dokumentasi & Regulasi,⏳Build,Memeriksa kepatuhan terhadap kebijakan internal,Menjamin kesesuaian dengan regulasi internal,Memastikan kepatuhan internal,
,Bot Pengelolaan Sertifikasi,Dokumentasi & Regulasi,⏳Build,Memastikan produk mematuhi standar sertifikasi,Menjamin kelancaran proses sertifikasi produk,Mengelola sertifikasi produk,
,Bot Penyusunan Paten,Dokumentasi & Regulasi,⏳Build,Menyusun permohonan paten,Mengurus hak paten untuk produk,Menyusun dokumen paten produk,
,Bot Pengelolaan Sertifikasi,Dokumentasi & Regulasi,⏳Build,Mengelola dokumen sertifikasi,Menjamin kelancaran proses sertifikasi,Mengelola sertifikasi produk,
,Otobot Transfer Produksi,Transfer Produksi,⏳Build,Menjamin kelancaran transfer produksi,Memastikan transisi produksi lancar,Mengelola transfer produksi,
,Bot Transfer Teknologi Produksi,Transfer Produksi,⏳Build,Memindahkan teknologi produksi,Menjamin teknologi dipindahkan dengan benar,Mengelola transfer teknologi,
,Bot Batch Pilot,Transfer Produksi,⏳Build,Mengelola batch pilot produksi,Menjamin kelancaran produksi pertama,Mengelola produksi skala pilot,
