rank,opportunity,core_offer,demand_signal,rate_source,typical_rate_usd_per_hour,est_monthly_usd_10h_week,est_monthly_idr_10h_week,difficulty,notes
1,AI Workflow Automation Consultant,Audit dan otomatisasi alur kerja SMB dengan AI + no-code,"Upwork AI Apps & Integrations +200% YoY; Indonesia transaksi digital naik",https://www.upwork.com/resources/freelance-rates-by-country,USD 40-80,USD 1600-3200,Rp 26956800-53913600,Medium,Rekomendasi fokus pada UMKM jasa dan seller marketplace
2,AI Chatbot Builder (WhatsApp/Web),Deploy chatbot CS+sales dengan handoff ke manusia,"Fiverr AI app development +18,347% YoY; Upwork AI Apps & Integrations +200%",https://www.upwork.com/resources/freelance-rates-by-country,USD 30-60,USD 1200-2400,Rp 20217600-40435200,Medium,Produkkan sebagai paket setup + monthly maintenance
3,Prompt Engineering and Content Ops,Membuat sistem prompt brand voice dan pipeline konten,"Upwork Generative AI Modeling +220% YoY; Fiverr personal branding +9,633%",https://www.upwork.com/resources/freelance-rates-by-country,USD 30-90,USD 1200-3600,Rp 20217600-60652800,Low-Medium,Cocok untuk sampingan cepat karena delivery bisa asinkron
4,Data Labeling and Extraction Service,Layanan labeling, cleaning, dan extraction dataset AI,"Upwork AI Data Annotation +130% YoY; AI Data Extraction +54%",https://www.upwork.com/resources/freelance-rates-by-country,USD 35-60,USD 1400-2400,Rp 23587200-40435200,Medium,Tambah SOP QC untuk diferensiasi kualitas
5,AI Analytics Dashboard for Sellers,Dashboard prediksi sales dan rekomendasi stok/harga,"Indonesia GMV digital ~USD 100B; e-commerce Rp742T",https://www.upwork.com/resources/freelance-rates-by-country,USD 40-90,USD 1600-3600,Rp 26956800-60652800,Medium-High,Target seller dengan ad spend rutin agar mau retainer
6,Niche AI Micro-SaaS Builder,Bangun alat AI kecil untuk workflow spesifik (B2B),"Gartner GenAI spend USD 644B in 2025; Upwork AI demand naik tajam",https://www.upwork.com/resources/freelance-rates-by-country,USD 30-100,USD 1200-4000,Rp 20217600-67392000,High,Start dari jasa lalu ubah jadi produk langganan
7,AI Team Training and Consulting,Workshop AI untuk tim sales/ops/content,"WEF: 85% employer akan upskill; 70% rekrut talenta skill baru",https://www.upwork.com/resources/freelance-rates-by-country,USD 28-98,USD 1120-3920,Rp 18869760-66044160,Medium,Lead generation efektif via webinar mini + studi kasus lokal
